{
  "$schema": "./_role.schema.json",
  "roleName": "CollisionSpike Admin",
  "schemaName": "cr1bd_CollisionSpikeAdmin",
  "supersetOf": "cr1bd_CollisionSpikeUser",
  "summary": "User + the configuration/governance surface: WRITE on the governed corpus, manage the audit-log retention/integrity, and CRUD the feature-gate environment-variable definitions AND values. The in-app Admin role -- NOT Dataverse System Administrator or Power Platform Administrator.",
  "appliesTo": "Management / configuration owner: edits the provider & inspection-address corpus, resolves ImprovementSignals, sets the env-var feature gates and per-environment config values, and reviews/administers the audit trail. Superset of CollisionSpike User.",
  "lifecycle": {
    "state": "built-gated-off",
    "assignment": "operator-assigns-at-activation",
    "note": "Phase 9 / ADR-0017 G8. Created live by 28-roles.ps1 but NEVER assigned. This file is FULL/self-contained (it restates every User privilege plus the Admin additions) -- 28-roles.ps1 never merges roles, so each role JSON is the complete grant. 'Admin' here is the APP settings/audit role, not Dataverse System Administrator. See docs/roles-and-permissions.md."
  },
  "businessUnit": {
    "resolve": "root-business-unit",
    "note": "Single-BU environment: 'Organization' depth == all rows. Same model as the User role."
  },
  "tablePrivileges": [
    {
      "table": "cr1bd_case",
      "rationale": "Inherits User's case CRUD. Delete STILL withheld at this in-app tier -- automated case disposition/erasure (ADR-0017) runs as the disposition flow's identity, not an interactive Admin, so even Admin does not get an everyday case-delete button. (If a manual admin delete UI is later wanted, raise Delete here deliberately.)",
      "privileges": {
        "Create": "Organization",
        "Read": "Organization",
        "Write": "Organization",
        "Delete": "None",
        "Append": "Organization",
        "AppendTo": "Organization",
        "Assign": "None",
        "Share": "None"
      }
    },
    {
      "table": "cr1bd_evidence",
      "rationale": "Same as User: full CRUD on case attachments.",
      "privileges": {
        "Create": "Organization",
        "Read": "Organization",
        "Write": "Organization",
        "Delete": "Organization",
        "Append": "Organization",
        "AppendTo": "Organization",
        "Assign": "None",
        "Share": "None"
      }
    },
    {
      "table": "cr1bd_inboundemail",
      "rationale": "Inherits User's triage CRUD AND gains Delete -- an Admin may purge a mis-triaged / test triage row as a configuration/cleanup action (still subject to the dedup caveat; do so knowingly).",
      "privileges": {
        "Create": "Organization",
        "Read": "Organization",
        "Write": "Organization",
        "Delete": "Organization",
        "Append": "Organization",
        "AppendTo": "Organization",
        "Assign": "None",
        "Share": "None"
      }
    },
    {
      "table": "cr1bd_chaser",
      "rationale": "Same as User: full CRUD on chasers.",
      "privileges": {
        "Create": "Organization",
        "Read": "Organization",
        "Write": "Organization",
        "Delete": "Organization",
        "Append": "Organization",
        "AppendTo": "Organization",
        "Assign": "None",
        "Share": "None"
      }
    },
    {
      "table": "cr1bd_note",
      "rationale": "Same as User: full CRUD on notes.",
      "privileges": {
        "Create": "Organization",
        "Read": "Organization",
        "Write": "Organization",
        "Delete": "Organization",
        "Append": "Organization",
        "AppendTo": "Organization",
        "Assign": "None",
        "Share": "None"
      }
    },
    {
      "table": "cr1bd_improvementsignal",
      "rationale": "ADMIN ADDITION: Management TRIAGES the improvement-signal queue. Where User can only Create+Read (raise a signal), Admin gains Write + Delete to resolve/classify/clear signals (the 'ImprovementSignal feeds a review queue Management works' governance rule).",
      "privileges": {
        "Create": "Organization",
        "Read": "Organization",
        "Write": "Organization",
        "Delete": "Organization",
        "Append": "Organization",
        "AppendTo": "Organization",
        "Assign": "None",
        "Share": "None"
      }
    },
    {
      "table": "cr1bd_workprovider",
      "rationale": "ADMIN ADDITION: Management EDITS the provider corpus. Create+Read+Write+Append/AppendTo. Delete WITHHELD -- referenced providers are NEVER hard-deleted (Case/PO history depends on old principal codes); they are deactivated/archived/merged via the cr1bd_active flag (a Write), never deleted (governance rule).",
      "privileges": {
        "Create": "Organization",
        "Read": "Organization",
        "Write": "Organization",
        "Delete": "None",
        "Append": "Organization",
        "AppendTo": "Organization",
        "Assign": "None",
        "Share": "None"
      }
    },
    {
      "table": "cr1bd_repairer",
      "rationale": "ADMIN ADDITION: Management edits the repairer corpus. Create+Read+Write+Append/AppendTo. Delete WITHHELD (same archive-not-delete rule; a referenced repairer is deactivated/merged, not deleted).",
      "privileges": {
        "Create": "Organization",
        "Read": "Organization",
        "Write": "Organization",
        "Delete": "None",
        "Append": "Organization",
        "AppendTo": "Organization",
        "Assign": "None",
        "Share": "None"
      }
    },
    {
      "table": "cr1bd_inspectionaddress",
      "rationale": "ADMIN ADDITION: Management curates the offline-derived inspection-address suggestions corpus (ADR-0013/0016). Create+Read+Write+Append/AppendTo. Delete WITHHELD (archive-not-delete; the corpus is bulk-reseeded offline via 16-seed-suggested-addresses, and a referenced row is superseded, not deleted).",
      "privileges": {
        "Create": "Organization",
        "Read": "Organization",
        "Write": "Organization",
        "Delete": "None",
        "Append": "Organization",
        "AppendTo": "Organization",
        "Assign": "None",
        "Share": "None"
      }
    },
    {
      "table": "cr1bd_imagesource",
      "rationale": "ADMIN ADDITION: Management edits image-source corpus rows. Create+Read+Write+Append/AppendTo. Delete WITHHELD (archive-not-delete).",
      "privileges": {
        "Create": "Organization",
        "Read": "Organization",
        "Write": "Organization",
        "Delete": "None",
        "Append": "Organization",
        "AppendTo": "Organization",
        "Assign": "None",
        "Share": "None"
      }
    },
    {
      "table": "cr1bd_fieldlevelprovenance",
      "rationale": "Same as User: Create/Read/Write/Append (no Delete) on per-field provenance.",
      "privileges": {
        "Create": "Organization",
        "Read": "Organization",
        "Write": "Organization",
        "Delete": "None",
        "Append": "Organization",
        "AppendTo": "Organization",
        "Assign": "None",
        "Share": "None"
      }
    },
    {
      "table": "cr1bd_auditevent",
      "rationale": "ADMIN ADDITION (audit-log MANAGEMENT). Create+Read like User, PLUS Delete -- the ADR-0017 audit-trail-integrity item gives Admin the cascade/disposition authority over audit rows (what becomes of audit rows when a Case is hard-deleted by disposition/DSAR). Write STILL WITHHELD -- audit rows are append-only and must never be EDITED in place even by an Admin (tamper-evidence); the only mutation an Admin may perform is a governed Delete (retention cascade), not an edit.",
      "privileges": {
        "Create": "Organization",
        "Read": "Organization",
        "Write": "None",
        "Delete": "Organization",
        "Append": "Organization",
        "AppendTo": "Organization",
        "Assign": "None",
        "Share": "None"
      }
    }
  ],
  "miscPrivileges": [
    {
      "privilegeName": "prvCreateEnvironmentVariableDefinition",
      "depth": "Organization",
      "rationale": "ADMIN ADDITION: manage the feature-gate env-var DEFINITIONS (EVA_API_ENABLED, BOX_* set, ...). Definition = the gate's name/type/default."
    },
    {
      "privilegeName": "prvReadEnvironmentVariableDefinition",
      "depth": "Organization",
      "rationale": "Read the env-var definitions (the gate catalogue). NOTE: the Code App reads gate VALUES read-only at runtime under whatever role it runs as; this Admin grant is for the configuration UI/manual edits, not the app's runtime read."
    },
    {
      "privilegeName": "prvWriteEnvironmentVariableDefinition",
      "depth": "Organization",
      "rationale": "Edit a gate definition (rename/default/description). Used rarely (definitions ship in the solution); included so an Admin can adjust without System Administrator."
    },
    {
      "privilegeName": "prvCreateEnvironmentVariableValue",
      "depth": "Organization",
      "rationale": "Set the per-environment VALUE that overrides a gate's default -- THE activation lever (flip BOX_API_ENABLED true, set BOX_FOLDER_ROOT_ID, etc.). This is the heart of 'Admin = settings'."
    },
    {
      "privilegeName": "prvReadEnvironmentVariableValue",
      "depth": "Organization",
      "rationale": "Read the per-environment gate values (what is currently on/off, what config strings are set)."
    },
    {
      "privilegeName": "prvWriteEnvironmentVariableValue",
      "depth": "Organization",
      "rationale": "Change an existing gate value (toggle a gate, update a config string). Paired with Create for full value management."
    },
    {
      "privilegeName": "prvDeleteEnvironmentVariableValue",
      "depth": "Organization",